{
  "version": 2,
  "generated_at": "2026-03-05T05:45:01.237Z",
  "source": "draft",
  "policies": [
    {
      "policy_id": "DRAFT-LEAK-001",
      "title": "Customer scope draft leak canary (test only)",
      "status": "draft",
      "type": "perpetual",
      "domain": "merchandise",
      "visibility": null,
      "category_path": "draft/in-progress/merchandise",
      "effective_from": null,
      "effective_to": null,
      "priority": 1,
      "owner_team": "Policy Ops",
      "approvers": [
        "Head of Support"
      ],
      "jurisdiction": [
        "Global"
      ],
      "applies_to": [
        "Test harness"
      ],
      "tags": [
        "test",
        "canary",
        "draft-leak"
      ],
      "path": "draft/in-progress/merchandise/DRAFT-LEAK-001_customer-scope-canary.md",
      "sections": [
        {
          "section_id": "4905a46d5708aa19bfb35be5ca434c9123121280df12f569f62526fb0a4572a7",
          "heading": "Summary",
          "content": "Test-only draft canary policy. Must never appear in customer scope retrieval."
        },
        {
          "section_id": "189799e95f65f874af0050fbc033e7c108dff60c3821b25a6fd8ce691c6585b8",
          "heading": "Canary",
          "content": "CANARY_PHRASE_DO_NOT_LEAK_TO_CUSTOMER_SCOPE_9f3d8c7a"
        }
      ],
      "raw_markdown": "---\npolicy_id: DRAFT-LEAK-001\ntitle: \"Customer scope draft leak canary (test only)\"\nstatus: draft\ntype: perpetual\ndomain: merchandise\neffective_from:\neffective_to:\npriority: 1\nowner_team: \"Policy Ops\"\napprovers:\n  - \"Head of Support\"\njurisdiction:\n  - \"Global\"\napplies_to:\n  - \"Test harness\"\ntags:\n  - \"test\"\n  - \"canary\"\n  - \"draft-leak\"\n---\n\n# Summary\nTest-only draft canary policy. Must never appear in customer scope retrieval.\n\n# Canary\nCANARY_PHRASE_DO_NOT_LEAK_TO_CUSTOMER_SCOPE_9f3d8c7a\n"
    },
    {
      "policy_id": "REF-NEW",
      "title": "Refund policy rewrite (draft)",
      "status": "draft",
      "type": "perpetual",
      "domain": "merchandise",
      "visibility": null,
      "category_path": "draft/in-progress/merchandise",
      "effective_from": null,
      "effective_to": null,
      "priority": 3,
      "owner_team": "Policy Ops",
      "approvers": [
        "Head of Support"
      ],
      "jurisdiction": [
        "Global"
      ],
      "applies_to": [
        "Support agents"
      ],
      "tags": [
        "refunds",
        "draft"
      ],
      "path": "draft/in-progress/merchandise/REF-NEW_refunds-rewrite.md",
      "sections": [
        {
          "section_id": "1b93bc17e3dbe78e8a80fee5e7a495876253fd1f27b96655b0d7308e5398975b",
          "heading": "Summary",
          "content": "Draft rewrite of the refund policy for review."
        },
        {
          "section_id": "a7db729d442ff31be6d21f22ce1001ce455ef096f582d0db0b06408ca637c751",
          "heading": "When it applies",
          "content": "Use during internal policy review and testing."
        },
        {
          "section_id": "fa4f173a8e1b4255fffad4b7c557f8600087a6e4c76c0e182639f412c550f201",
          "heading": "Rules",
          "content": "- Draft content only; do not apply to customers."
        },
        {
          "section_id": "925eb61e102deaa8f25d434602048b869c15dad976cf6772ecb18b99a8ad9474",
          "heading": "Allowed actions",
          "content": "- Review and provide feedback on proposed language."
        },
        {
          "section_id": "46192fe965466ce757e6a747b977026fa2175176eff9a608fe47a12368545232",
          "heading": "Disallowed actions",
          "content": "- Enforce this draft policy in production."
        },
        {
          "section_id": "973e73cf3d3d6a333d5a939d2b7d60775214e902d3f986d7396124c83b9a1d5a",
          "heading": "Required wording",
          "content": "\"This is a draft policy under review and not yet effective.\""
        },
        {
          "section_id": "8da9747f11c62fdce0e47b680e84248c78067b3a5903ea089a4e4ef952168d5c",
          "heading": "Escalation",
          "content": "Escalate questions to Policy Ops."
        },
        {
          "section_id": "8a2b582d4697a9ba679572499e1f9a7171b78e43400082add217ce3a7cfda544",
          "heading": "Examples",
          "content": "A reviewer flags missing edge cases and requests clarification."
        }
      ],
      "raw_markdown": "---\npolicy_id: REF-NEW\ntitle: \"Refund policy rewrite (draft)\"\nstatus: draft\ntype: perpetual\ndomain: merchandise\neffective_from:\neffective_to:\npriority: 3\nowner_team: \"Policy Ops\"\napprovers:\n  - \"Head of Support\"\njurisdiction:\n  - \"Global\"\napplies_to:\n  - \"Support agents\"\ntags:\n  - \"refunds\"\n  - \"draft\"\n---\n\n# Summary\nDraft rewrite of the refund policy for review.\n\n# When it applies\nUse during internal policy review and testing.\n\n# Rules\n- Draft content only; do not apply to customers.\n\n# Allowed actions\n- Review and provide feedback on proposed language.\n\n# Disallowed actions\n- Enforce this draft policy in production.\n\n# Required wording\n\"This is a draft policy under review and not yet effective.\"\n\n# Escalation\nEscalate questions to Policy Ops.\n\n# Examples\nA reviewer flags missing edge cases and requests clarification.\n"
    }
  ]
}
